{
  "schemaVersion": "proofrail.reason-code-registry.v1",
  "namespace": "PROOFRAIL_OWNED_PRODUCT_CODES",
  "aliasPolicy": "FORBIDDEN",
  "policyRuleCodeBoundary": "POLICY_OWNED_EXCLUDED",
  "codes": [
    {
      "id": "ACCESSOR_FIELD",
      "kind": "BOUNDARY_ISSUE",
      "category": "INPUT",
      "surfaces": [
        "kernel"
      ],
      "visibility": "PUBLIC",
      "severity": "ERROR",
      "retryable": false,
      "status": "ACTIVE",
      "description": "An authoritative object exposes a getter or setter instead of a plain data field.",
      "remediation": "Replace accessor-backed fields with ordinary enumerable data properties before evaluation.",
      "replacement": null
    },
    {
      "id": "AUTHORITY_LIMIT_EXCEEDED",
      "kind": "COMPONENT_ERROR",
      "category": "AUTHORITY",
      "surfaces": [
        "trusted-config"
      ],
      "visibility": "PUBLIC",
      "severity": "ERROR",
      "retryable": false,
      "status": "ACTIVE",
      "description": "A repository configuration requests authority beyond the maxima fixed by Trusted Configuration.",
      "remediation": "Reduce the repository configuration to the authorized limits or issue new Trusted Configuration through the external authority path.",
      "replacement": null
    },
    {
      "id": "CONFLICTING_CONFIGURATION",
      "kind": "COMPONENT_ERROR",
      "category": "INPUT",
      "surfaces": [
        "trusted-config"
      ],
      "visibility": "PUBLIC",
      "severity": "ERROR",
      "retryable": false,
      "status": "ACTIVE",
      "description": "Repository configuration contains mutually inconsistent settings that cannot form one deterministic effective configuration.",
      "remediation": "Resolve the conflicting settings so the selected preset and repository overrides produce one unambiguous configuration.",
      "replacement": null
    },
    {
      "id": "CYCLIC_INPUT",
      "kind": "BOUNDARY_ISSUE",
      "category": "INPUT",
      "surfaces": [
        "kernel"
      ],
      "visibility": "PUBLIC",
      "severity": "ERROR",
      "retryable": false,
      "status": "ACTIVE",
      "description": "Authoritative kernel input contains a cyclic object or array reference.",
      "remediation": "Serialize the input as an acyclic JSON-compatible value graph.",
      "replacement": null
    },
    {
      "id": "DUPLICATE_IDENTITY",
      "kind": "BOUNDARY_ISSUE",
      "category": "INPUT",
      "surfaces": [
        "kernel",
        "trusted-config"
      ],
      "visibility": "PUBLIC",
      "severity": "ERROR",
      "retryable": false,
      "status": "ACTIVE",
      "description": "Two authoritative records declare the same stable identity in one validation scope.",
      "remediation": "Assign unique stable identities and update every affected reference consistently.",
      "replacement": null
    },
    {
      "id": "DUPLICATE_KEY",
      "kind": "COMPONENT_ERROR",
      "category": "INPUT",
      "surfaces": [
        "trusted-config"
      ],
      "visibility": "PUBLIC",
      "severity": "ERROR",
      "retryable": false,
      "status": "ACTIVE",
      "description": "A strict JSON authority document contains the same object key more than once.",
      "remediation": "Remove the duplicate key and supply one unambiguous value.",
      "replacement": null
    },
    {
      "id": "FILE_ALIAS",
      "kind": "COMPONENT_ERROR",
      "category": "FILESYSTEM",
      "surfaces": [
        "trusted-config"
      ],
      "visibility": "PUBLIC",
      "severity": "ERROR",
      "retryable": false,
      "status": "ACTIVE",
      "description": "Two selected authority paths resolve to the same underlying file or a selected file changes identity during validation.",
      "remediation": "Supply distinct regular files under the trusted root and retry from a stable filesystem state.",
      "replacement": null
    },
    {
      "id": "FORBIDDEN_AUTHORITY_FIELD",
      "kind": "BOUNDARY_ISSUE",
      "category": "AUTHORITY",
      "surfaces": [
        "kernel"
      ],
      "visibility": "PUBLIC",
      "severity": "ERROR",
      "retryable": false,
      "status": "ACTIVE",
      "description": "Kernel input contains a field that could introduce an unauthorized authority source.",
      "remediation": "Remove the forbidden field and use only the accepted deterministic authority path.",
      "replacement": null
    },
    {
      "id": "HASH_MISMATCH",
      "kind": "COMPONENT_ERROR",
      "category": "INTEGRITY",
      "surfaces": [
        "trusted-config"
      ],
      "visibility": "PUBLIC",
      "severity": "ERROR",
      "retryable": false,
      "status": "ACTIVE",
      "description": "An authority document does not match the SHA-256 bound by Trusted Configuration.",
      "remediation": "Restore the exact authorized bytes or issue a new trusted configuration with the correct digest.",
      "replacement": null
    },
    {
      "id": "INVALID_ARGUMENT",
      "kind": "COMPONENT_ERROR",
      "category": "INPUT",
      "surfaces": [
        "trusted-config"
      ],
      "visibility": "PUBLIC",
      "severity": "ERROR",
      "retryable": false,
      "status": "ACTIVE",
      "description": "The trusted-configuration loader received a missing or invalid invocation argument.",
      "remediation": "Provide non-empty trusted configuration and repository-root paths.",
      "replacement": null
    },
    {
      "id": "INVALID_ARRAY",
      "kind": "BOUNDARY_ISSUE",
      "category": "INPUT",
      "surfaces": [
        "kernel"
      ],
      "visibility": "PUBLIC",
      "severity": "ERROR",
      "retryable": false,
      "status": "ACTIVE",
      "description": "An authoritative array is malformed, sparse, extended, or does not use the ordinary Array prototype.",
      "remediation": "Use a dense ordinary array containing only accepted JSON-compatible values.",
      "replacement": null
    },
    {
      "id": "INVALID_EVIDENCE_CONTRACT_SELECTION_PROVENANCE",
      "kind": "BOUNDARY_ISSUE",
      "category": "AUTHORITY",
      "surfaces": [
        "kernel"
      ],
      "visibility": "PUBLIC",
      "severity": "ERROR",
      "retryable": false,
      "status": "ACTIVE",
      "description": "Evidence Contract selection provenance is outside the accepted trusted configuration or deterministic Policy paths.",
      "remediation": "Supply selection provenance from an authorized Trusted Configuration or deterministic Policy selection.",
      "replacement": null
    },
    {
      "id": "INVALID_JSON_PRIMITIVE",
      "kind": "BOUNDARY_ISSUE",
      "category": "INPUT",
      "surfaces": [
        "kernel"
      ],
      "visibility": "PUBLIC",
      "severity": "ERROR",
      "retryable": false,
      "status": "ACTIVE",
      "description": "A field requiring a JSON primitive received an object, array, undefined value, or unsupported number.",
      "remediation": "Use null, a boolean, a string, or a finite JSON number as required.",
      "replacement": null
    },
    {
      "id": "INVALID_LITERAL",
      "kind": "BOUNDARY_ISSUE",
      "category": "INPUT",
      "surfaces": [
        "kernel"
      ],
      "visibility": "PUBLIC",
      "severity": "ERROR",
      "retryable": false,
      "status": "ACTIVE",
      "description": "An authoritative field does not equal the exact protocol literal required at that path.",
      "remediation": "Replace the value with the documented exact literal for the selected schema version.",
      "replacement": null
    },
    {
      "id": "INVALID_REASON_CODE",
      "kind": "BOUNDARY_ISSUE",
      "category": "INPUT",
      "surfaces": [
        "kernel"
      ],
      "visibility": "PUBLIC",
      "severity": "ERROR",
      "retryable": false,
      "status": "ACTIVE",
      "description": "A Policy-owned Rule denial code is not a stable uppercase machine token.",
      "remediation": "Use a non-empty code matching the accepted uppercase token format.",
      "replacement": null
    },
    {
      "id": "INVALID_REFERENCE",
      "kind": "BOUNDARY_ISSUE",
      "category": "AUTHORITY",
      "surfaces": [
        "kernel"
      ],
      "visibility": "PUBLIC",
      "severity": "ERROR",
      "retryable": false,
      "status": "ACTIVE",
      "description": "An authoritative record references a missing or inconsistent related identity.",
      "remediation": "Repair the referenced identity and its bidirectional membership without fabricating Evidence.",
      "replacement": null
    },
    {
      "id": "INVALID_RULE_AUTHORITY_PROVENANCE",
      "kind": "BOUNDARY_ISSUE",
      "category": "AUTHORITY",
      "surfaces": [
        "kernel"
      ],
      "visibility": "PUBLIC",
      "severity": "ERROR",
      "retryable": false,
      "status": "ACTIVE",
      "description": "A Rule declares authority outside Trusted Configuration or Policy provenance.",
      "remediation": "Bind the Rule to an authorized Trusted Configuration or versioned Policy.",
      "replacement": null
    },
    {
      "id": "INVALID_RULE_PREDICATE",
      "kind": "BOUNDARY_ISSUE",
      "category": "INPUT",
      "surfaces": [
        "kernel"
      ],
      "visibility": "PUBLIC",
      "severity": "ERROR",
      "retryable": false,
      "status": "ACTIVE",
      "description": "A Rule predicate is outside the deterministic predicate set supported by the current kernel.",
      "remediation": "Use an accepted predicate or select a separately authorized kernel version.",
      "replacement": null
    },
    {
      "id": "INVALID_STABLE_IDENTITY",
      "kind": "BOUNDARY_ISSUE",
      "category": "INPUT",
      "surfaces": [
        "kernel"
      ],
      "visibility": "PUBLIC",
      "severity": "ERROR",
      "retryable": false,
      "status": "ACTIVE",
      "description": "An identity is empty or contains characters outside the stable identity alphabet.",